candidate_id,source,evidence_item,required_evidence,evidence_source,current_status,blocking,risk_level,next_action,audit_status
GSE137029,GEO / NCBI,patient/donor ID field,"Exact original patient or donor field name; field level; observed non-sensitive identifier pattern; completeness and uniqueness","GEO Series/Sample metadata; repository metadata matrix or data dictionary; linked publication supplement",blocked,true,critical,"Inspect only explicitly approved metadata assets and record the exact source field without constructing identifiers",evidence_plan_pending
GSE137029,GEO / NCBI,sample-to-patient mapping,"Explicit mapping among sample/library IDs and patient or donor IDs; repeated-sample relationships; missingness","GEO Sample records; repository-provided sample metadata; linked publication supplement",blocked,true,critical,"Create a source-preserving mapping report after approved metadata inspection",evidence_plan_pending
GSE137029,GEO / NCBI,case/control label linkage,"Exact diagnosis field and observed values linked from every sample to a stable patient/donor ID","GEO Sample metadata; repository metadata/data dictionary; publication methods and supplement",blocked,true,critical,"Record source fields definitions values linkage and patient-level class counts",evidence_plan_pending
CELLxGENE_HCA_436154da-bcf1-4130-9c8b-120ff9a888f2_218acb0f-9f2f-4f76-b90b-15a4b7c7f629,CELLxGENE / HCA,donor ID field,"Exact donor field name; completeness; uniqueness; stable grouping; original-source provenance","CELLxGENE dataset metadata/schema; HCA project manifest and data dictionary",pending,true,high,"Confirm field-level completeness and provenance; visible donor values alone do not establish training usability",evidence_plan_pending
CELLxGENE_HCA_436154da-bcf1-4130-9c8b-120ff9a888f2_218acb0f-9f2f-4f76-b90b-15a4b7c7f629,CELLxGENE / HCA,sample ID field,"Exact sample/specimen/library field; donor-to-sample relationship; repeated samples; missingness","CELLxGENE dataset metadata/schema; HCA project manifest and data dictionary",blocked,true,critical,"Identify explicit sample-level fields and relationships without deriving IDs from cells or filenames",evidence_plan_pending
CELLxGENE_HCA_436154da-bcf1-4130-9c8b-120ff9a888f2_218acb0f-9f2f-4f76-b90b-15a4b7c7f629,CELLxGENE / HCA,disease label linkage,"Exact disease field and ontology values linked to donor/sample IDs with missingness and comparator review","CELLxGENE dataset metadata/schema; HCA project metadata; original publication supplement",blocked,true,critical,"Document donor-level SLE/control linkage and preserve original ontology values",evidence_plan_pending
GSE137029::CELLxGENE_HCA,GEO / NCBI + CELLxGENE / HCA,cohort overlap check,"Source-supported correspondence or independence of studies donors samples libraries and cells across repositories","GEO/HCA/CELLxGENE cross-references; publication identifiers; source-supported donor/sample mappings",blocked,true,critical,"Reconcile accession project collection dataset publication and any explicit identifier mappings before assigning cohort roles",evidence_plan_pending
